{
    "$schema": "http://json-schema.org/draft-07/schema#",
    "type": "object",
    "required": ["host", "default_password", "sshPath", "roles", "accounts"],
    "properties": {
      "host": {
        "type": "string"
      },
      "default_password": {
        "type": "string"
      },
      "sshPath": {
        "type": "string",
        "pattern": "^/.+/.+"
      },
      "roles": {
        "type": "array",
        "items": {
          "type": "object",
          "required": ["name", "description", "policies", "groups"],
          "properties": {
            "name":          { "type": "string" },
            "description":   { "type": "string" },
            "policies": {
              "type": "array",
              "items": { "type": "string" }
            },
            "groups": {
              "type": "array",
              "items": { "type": "string" }
            }
          }
        }
      },
      "accounts": {
        "type": "array",
        "items": {
          "type": "object",
          "required": ["name", "group", "access"],
          "properties": {
            "name":   { "type": "string" },
            "group":  { "type": "string" },
            "access": { "type": "string", "enum": ["login"] }
          }
        }
      }
    },
    "additionalProperties": false
  }
  